{
  "$schema": "./cubis-foundry-route-manifest-v2.schema.json",
  "generatedAt": "1970-01-01T00:00:00.000Z",
  "contentHash": "74f8e201e7504a4c",
  "summary": {
    "totalRoutes": 18,
    "workflows": 10,
    "agents": 8
  },
  "routes": [
    {
      "kind": "agent",
      "id": "debugger",
      "command": null,
      "displayName": "debugger",
      "description": "Drive a systematic root-cause investigation, isolate the failure, and verify the fix instead of relying on patch-by-guessing.",
      "triggers": [],
      "primaryAgent": "debugger",
      "supportingAgents": [],
      "primarySkills": [
        "systematic-debugging"
      ],
      "supportingSkills": [],
      "artifacts": {
        "codex": {
          "target": "subagent",
          "agentFile": "debugger.toml"
        },
        "copilot": {
          "target": "custom-agent",
          "agentFile": "debugger.agent.md"
        },
        "antigravity": {
          "target": "command",
          "commandFile": "agent-debugger.toml"
        },
        "claude": {
          "target": "subagent",
          "agentFile": "debugger.md"
        },
        "gemini": {
          "target": "command",
          "commandFile": "agent-debugger.toml"
        }
      }
    },
    {
      "kind": "agent",
      "id": "explorer",
      "command": null,
      "displayName": "explorer",
      "description": "Map the relevant codebase surface quickly, identify ownership boundaries, and return the context needed for a downstream plan or implementation.",
      "triggers": [],
      "primaryAgent": "explorer",
      "supportingAgents": [],
      "primarySkills": [
        "spec-driven-delivery"
      ],
      "supportingSkills": [],
      "artifacts": {
        "codex": {
          "target": "subagent",
          "agentFile": "explorer.toml"
        },
        "copilot": {
          "target": "custom-agent",
          "agentFile": "explorer.agent.md"
        },
        "antigravity": {
          "target": "command",
          "commandFile": "agent-explorer.toml"
        },
        "claude": {
          "target": "subagent",
          "agentFile": "explorer.md"
        },
        "gemini": {
          "target": "command",
          "commandFile": "agent-explorer.toml"
        }
      }
    },
    {
      "kind": "agent",
      "id": "implementer",
      "command": null,
      "displayName": "implementer",
      "description": "Execute a validated plan by making code changes, keeping scope tight, and verifying outcomes before completion.",
      "triggers": [],
      "primaryAgent": "implementer",
      "supportingAgents": [],
      "primarySkills": [
        "frontend-design",
        "design"
      ],
      "supportingSkills": [
        "design-system",
        "web-testing",
        "android-emulator-testing",
        "ios-simulator-testing",
        "mobile-mcp",
        "systematic-debugging",
        "code-review",
        "owasp-security-review"
      ],
      "artifacts": {
        "codex": {
          "target": "subagent",
          "agentFile": "implementer.toml"
        },
        "copilot": {
          "target": "custom-agent",
          "agentFile": "implementer.agent.md"
        },
        "antigravity": {
          "target": "command",
          "commandFile": "agent-implementer.toml"
        },
        "claude": {
          "target": "subagent",
          "agentFile": "implementer.md"
        },
        "gemini": {
          "target": "command",
          "commandFile": "agent-implementer.toml"
        }
      }
    },
    {
      "kind": "agent",
      "id": "orchestrator",
      "command": null,
      "displayName": "orchestrator",
      "description": "Coordinate multi-step work by selecting workflows, delegating to specialists, and verifying completion against acceptance criteria.",
      "triggers": [],
      "primaryAgent": "orchestrator",
      "supportingAgents": [],
      "primarySkills": [
        "/plan",
        "/implement"
      ],
      "supportingSkills": [
        "/debug",
        "/review",
        "/test"
      ],
      "artifacts": {
        "codex": {
          "target": "subagent",
          "agentFile": "orchestrator.toml"
        },
        "copilot": {
          "target": "custom-agent",
          "agentFile": "orchestrator.agent.md"
        },
        "antigravity": {
          "target": "command",
          "commandFile": "agent-orchestrator.toml"
        },
        "claude": {
          "target": "subagent",
          "agentFile": "orchestrator.md"
        },
        "gemini": {
          "target": "command",
          "commandFile": "agent-orchestrator.toml"
        }
      }
    },
    {
      "kind": "agent",
      "id": "planner",
      "command": null,
      "displayName": "planner",
      "description": "Turn a goal into an execution-ready implementation plan with scoped tasks, dependencies, and verification checkpoints.",
      "triggers": [],
      "primaryAgent": "planner",
      "supportingAgents": [],
      "primarySkills": [
        "spec-driven-delivery",
        "system-design"
      ],
      "supportingSkills": [
        "api-design",
        "database-design",
        "frontend-design",
        "design-system",
        "web-ui-design",
        "mobile-ui-design",
        "desktop-ui-design",
        "deep-research"
      ],
      "artifacts": {
        "codex": {
          "target": "subagent",
          "agentFile": "planner.toml"
        },
        "copilot": {
          "target": "custom-agent",
          "agentFile": "planner.agent.md"
        },
        "antigravity": {
          "target": "command",
          "commandFile": "agent-planner.toml"
        },
        "claude": {
          "target": "subagent",
          "agentFile": "planner.md"
        },
        "gemini": {
          "target": "command",
          "commandFile": "agent-planner.toml"
        }
      }
    },
    {
      "kind": "agent",
      "id": "researcher",
      "command": null,
      "displayName": "researcher",
      "description": "Gather and synthesize current external evidence, prioritizing official sources and clearly labeling inference versus citation.",
      "triggers": [],
      "primaryAgent": "researcher",
      "supportingAgents": [],
      "primarySkills": [
        "deep-research"
      ],
      "supportingSkills": [],
      "artifacts": {
        "codex": {
          "target": "subagent",
          "agentFile": "researcher.toml"
        },
        "copilot": {
          "target": "custom-agent",
          "agentFile": "researcher.agent.md"
        },
        "antigravity": {
          "target": "command",
          "commandFile": "agent-researcher.toml"
        },
        "claude": {
          "target": "subagent",
          "agentFile": "researcher.md"
        },
        "gemini": {
          "target": "command",
          "commandFile": "agent-researcher.toml"
        }
      }
    },
    {
      "kind": "agent",
      "id": "reviewer",
      "command": null,
      "displayName": "reviewer",
      "description": "Review a change set for correctness, regression risk, missing tests, and security issues, with findings first.",
      "triggers": [],
      "primaryAgent": "reviewer",
      "supportingAgents": [],
      "primarySkills": [
        "code-review",
        "owasp-security-review"
      ],
      "supportingSkills": [
        "frontend-design",
        "design"
      ],
      "artifacts": {
        "codex": {
          "target": "subagent",
          "agentFile": "reviewer.toml"
        },
        "copilot": {
          "target": "custom-agent",
          "agentFile": "reviewer.agent.md"
        },
        "antigravity": {
          "target": "command",
          "commandFile": "agent-reviewer.toml"
        },
        "claude": {
          "target": "subagent",
          "agentFile": "reviewer.md"
        },
        "gemini": {
          "target": "command",
          "commandFile": "agent-reviewer.toml"
        }
      }
    },
    {
      "kind": "agent",
      "id": "tester",
      "command": null,
      "displayName": "tester",
      "description": "Expand or harden verification so the requested behavior is covered by repeatable tests and meaningful checks.",
      "triggers": [],
      "primaryAgent": "tester",
      "supportingAgents": [],
      "primarySkills": [
        "web-testing",
        "android-emulator-testing"
      ],
      "supportingSkills": [
        "ios-simulator-testing",
        "mobile-mcp"
      ],
      "artifacts": {
        "codex": {
          "target": "subagent",
          "agentFile": "tester.toml"
        },
        "copilot": {
          "target": "custom-agent",
          "agentFile": "tester.agent.md"
        },
        "antigravity": {
          "target": "command",
          "commandFile": "agent-tester.toml"
        },
        "claude": {
          "target": "subagent",
          "agentFile": "tester.md"
        },
        "gemini": {
          "target": "command",
          "commandFile": "agent-tester.toml"
        }
      }
    },
    {
      "kind": "workflow",
      "id": "debug",
      "command": "/debug",
      "displayName": "debug",
      "description": "Investigate a failure systematically, confirm the root cause, and verify the fix path.",
      "triggers": [
        "debug",
        "bug",
        "failure",
        "broken"
      ],
      "primaryAgent": "debugger",
      "supportingAgents": [],
      "primarySkills": [
        "systematic-debugging"
      ],
      "supportingSkills": [
        "web-testing",
        "android-emulator-testing",
        "ios-simulator-testing"
      ],
      "artifacts": {
        "codex": {
          "target": "skill",
          "skillDir": "debug"
        },
        "copilot": {
          "target": "prompt",
          "promptFile": "debug.prompt.md"
        },
        "antigravity": {
          "target": "command",
          "commandFile": "debug.toml"
        },
        "claude": {
          "target": "skill",